<?xml version="1.0" encoding="utf-8"?>
<!DOCTYPE keyboard SYSTEM "VirtualKeyboardLayout.dtd">

<keyboard catalog="general_test1_symbols" version="1.0">
  <layout type="general">
    <section id="symbols0" type="non-sloppy">
      <row>
        <key>
          <binding label="1" />
        </key>
      </row>
      <row>
        <key>
          <binding label="2" />
        </key>
      </row>
    </section>
    <section id="symbols1" type="non-sloppy">
      <row>
        <key>
          <binding label="3" />
        </key>
      </row>
      <row>
        <key>
          <binding label="4" />
        </key>
      </row>
    </section>
  </layout>
</keyboard>
