<?xml version="1.0" encoding="utf-8"?>
<!DOCTYPE keyboard SYSTEM "VirtualKeyboardLayout.dtd">

<keyboard catalog="icon_test2" language="icon_test2" title="IconTest2" version="1.0">
  <layout type="general">
    <section id="main">
      <row>
        <key>
          <binding label="q" />
        </key>
        <key>
          <binding label="w" icon="overriden_icon" />
        </key>
      </row>
    </section>
  </layout>
</keyboard>
