<?xml version="1.0" encoding="utf-8"?>
<!DOCTYPE keyboard SYSTEM 'VirtualKeyboardLayout.dtd'>
<keyboard title="Polski" version="1.0" catalog="pl" language="pl">
    <layout type="general" orientation="landscape">
        <section id="main" movable="false" vertical_alignment="center" horizontal_alignment="center">
          <row>
            <key>
              <binding label="q"/>
              <binding shift="true" label="Q"/>
            </key>
            <key>
              <binding label="w"/>
              <binding shift="true" label="W"/>
            </key>
            <key>
              <binding label="e"/>
              <binding shift="true" label="E"/>
            </key>
            <key>
              <binding label="r"/>
              <binding shift="true" label="R"/>
            </key>
            <key>
              <binding label="t"/>
              <binding shift="true" label="T"/>
            </key>
            <key>
              <binding label="y"/>
              <binding shift="true" label="Y"/>
            </key>
            <key>
              <binding label="u"/>
              <binding shift="true" label="U"/>
            </key>
            <key>
              <binding label="i"/>
              <binding shift="true" label="I"/>
            </key>
            <key>
              <binding accented_labels="ó" accents="´" label="o"/>
              <binding shift="true" accented_labels="Ó" accents="´" label="O"/>
            </key>
            <key>
              <binding label="p"/>
              <binding shift="true" label="P"/>
            </key>
            <key>
              <binding label="ż"/>
              <binding shift="true" label="Ż"/>
            </key>
          </row>
          <row>
            <key>
              <binding label="a"/>
              <binding shift="true" label="A"/>
            </key>
            <key>
              <binding accented_labels="ś" accents="´" label="s"/>
              <binding shift="true" accented_labels="Ś" accents="´" label="S"/>
            </key>
            <key>
              <binding label="d"/>
              <binding shift="true" label="D"/>
            </key>
            <key>
              <binding label="f"/>
              <binding shift="true" label="F"/>
            </key>
            <key>
              <binding label="g"/>
              <binding shift="true" label="G"/>
            </key>
            <key>
              <binding label="h"/>
              <binding shift="true" label="H"/>
            </key>
            <key>
              <binding label="j"/>
              <binding shift="true" label="J"/>
            </key>
            <key>
              <binding label="k"/>
              <binding shift="true" label="K"/>
            </key>
            <key>
              <binding label="l"/>
              <binding shift="true" label="L"/>
            </key>
            <key>
              <binding label="ł"/>
              <binding shift="true" label="Ł"/>
            </key>
            <key>
              <binding dead="true" label="´"/>
            </key>
          </row>
          <row>
            <key>
              <binding accented_labels="ź" accents="´" label="z"/>
              <binding shift="true" accented_labels="Ź" accents="´" label="Z"/>
            </key>
            <key>
              <binding label="x"/>
              <binding shift="true" label="X"/>
            </key>
            <key>
              <binding accented_labels="ć" accents="´" label="c"/>
              <binding shift="true" accented_labels="Ć" accents="´" label="C"/>
            </key>
            <key>
              <binding label="v"/>
              <binding shift="true" label="V"/>
            </key>
            <key>
              <binding label="b"/>
              <binding shift="true" label="B"/>
            </key>
            <key>
              <binding accented_labels="ń" accents="´" label="n"/>
              <binding shift="true" accented_labels="Ń" accents="´" label="N"/>
            </key>
            <key>
              <binding label="m"/>
              <binding shift="true" label="M"/>
            </key>
            <key>
              <binding label="ą"/>
              <binding shift="true" label="Ą"/>
            </key>
            <key>
              <binding label="ę"/>
              <binding shift="true" label="Ę"/>
            </key>
            <key>
              <binding action="backspace" label=""/>
            </key>
          </row>
        </section>
        <section id="functionkey" movable="false" horizontal_alignment="left" vertical_alignment="center">
          <row>
            <key>
              <binding action="shift" label=""/>
            </key>
            <key>
              <binding action="sym" label="Sym" secondary_label="áçè"/>
              <binding shift="true" action="layout_menu" label=""/>
            </key>
            <key>
              <binding label="?"/>
              <binding shift="true" label="!"/>
            </key>
            <key>
              <binding action="space" label=""/>
            </key>
            <key>
              <binding label=","/>
              <binding shift="true" label="-"/>
            </key>
            <key>
              <binding label="."/>
              <binding shift="true" label=":"/>
            </key>
            <key>
              <binding action="return" label=""/>
            </key>
          </row>
        </section>
    </layout>
    <layout type="general" orientation="portrait">
        <section id="functionkey" movable="false" horizontal_alignment="left" vertical_alignment="center">
          <row>
            <key>
              <binding action="shift" label=""/>
            </key>
            <key>
              <binding action="sym" label="Sym" secondary_label="áçè"/>
              <binding shift="true" action="layout_menu" label=""/>
            </key>
            <key>
              <binding action="space" label=""/>
            </key>
            <key>
              <binding label="."/>
              <binding shift="true" label=","/>
            </key>
            <key>
              <binding action="return" label=""/>
            </key>
          </row>
        </section>
    </layout>
    <import file="symbols.xml"/>
</keyboard>
