<?xml version="1.0" encoding="utf-8"?>
<!DOCTYPE keyboard SYSTEM "VirtualKeyboardLayout.dtd">

<keyboard catalog="style_test2" version="1.0">
  <layout type="general">
    <section id="symbols0" type="non-sloppy" style="four_symbols">
      <row>
        <key>
          <binding label="!" />
        </key>
        <key>
          <binding label="@" />
        </key>
        <key>
          <binding label="#" />
        </key>
        <key>
          <binding label="$" />
        </key>
      </row>
    </section>
  </layout>
</keyboard>
