<?xml version="1.0" encoding="utf-8"?>
<!DOCTYPE keyboard SYSTEM 'VirtualKeyboardLayout.dtd'>
<keyboard version="1.0" title="فارسى" language="fa" catalog="virtual-keyboard" autocapitalization="false">
  <layout type="general">
    <section id="main" style="bigfont">
      <row>
        <key>
          <binding label="ض"/>
        </key>
        <key>
          <binding label="ص"/>
        </key>
        <key>
          <binding label="ث"/>
        </key>
        <key>
          <binding label="ق"/>
        </key>
        <key>
          <binding label="ف"/>
        </key>
        <key>
          <binding label="غ"/>
        </key>
        <key>
          <binding label="ع"/>
        </key>
        <key>
          <binding label="ه"/>
        </key>
        <key>
          <binding label="ح"/>
          <binding shift="true" label="خ"/>          
        </key>
        <key>
          <binding label="ج"/>
          <binding shift="true" label="چ"/>
        </key>
      </row>

      <row>
        <key>
          <binding label="ش"/>
        </key>
        <key>
          <binding label="س"/>
        </key>
        <key>
          <binding label="ی"/>
        </key>
        <key>
          <binding label="ب"/>
        </key>
        <key>
          <binding label="ل"/>
          <binding shift="true" label="ۀ"/>
        </key>
        <key>
          <binding label="ا"/>
          <binding shift="true" label="آ"/>
        </key>
        <key>
          <binding label="ت"/>
        </key>
        <key>
          <binding label="ن"/>
        </key>
        <key>
          <binding label="م"/>
          <binding shift="true" label="پ"/>
        </key>
        <key>
          <binding label="ک"/>
          <binding shift="true" label="گ"/>          
        </key>
      </row>
	
      <row>
        <key style="special" width="x-large">
          <binding action="shift"/>
        </key>

        <key>
          <binding label="ظ"/>
          <binding shift="true" label="ة"/>
        </key>
        <key>
          <binding label="ط"/>
          <binding shift="true" label="ي"/>
        </key>
        <key>
          <binding label="ز"/>
          <binding shift="true" label="ژ"/>
        </key>
        <key>
          <binding label="ر"/>
          <binding shift="true" label="ؤ"/>
        </key>
        <key>
          <binding label="ذ"/>
          <binding shift="true" label="إ"/>
        </key>
        <key>
          <binding label="د"/>
          <binding shift="true" label="أ"/>
        </key>
        <key>
          <binding label="ئ"/>
          <binding shift="true" label="ء"/>
        </key>

        <key style="special"  width="x-large">
          <binding action="backspace"/>
        </key>
      </row>

      <row>
        <key style="special" width="x-large">
          <binding action="sym" label="؟٣٢١"/>
        </key>
        
        <key id="emailUrlKey"><binding label="،"/></key>
        <key><binding label="."/></key>

        <key width="stretched">
          <binding action="space"/>
        </key>
        
        <key>
          <binding label="و"/>
        </key>

        <key style="special" width="xx-large" id="actionKey">
          <binding action="return"/>
        </key>
      </row>
    </section>
  </layout>

  <import file="symbols_fa.xml"/>
</keyboard>
