<?xml version="1.0" encoding="utf-8"?>
<!DOCTYPE keyboard SYSTEM 'VirtualKeyboardLayout.dtd'>
<keyboard version="1.0" catalog="symbols">
  <layout type="general">
    <section id="symbols0" type="non-sloppy">
      <row>
        <key>
          <binding label="&#x06F1;"/>
        </key>
        <key>
          <binding label="&#x06F2;"/>
        </key>
        <key>
          <binding label="&#x06F3;"/>
        </key>
        <key>
          <binding label="&#x06F4;"/>
        </key>
        <key>
          <binding label="&#x06F5;"/>
        </key>
        <key>
          <binding label="&#x06F6;"/>
        </key>
        <key>
          <binding label="&#x06F7;"/>
        </key>
        <key>
          <binding label="&#x06F8;"/>
        </key>
        <key>
          <binding label="&#x06F9;"/>
        </key>
        <key>
          <binding label="&#x06F0;"/>
        </key>
      </row>

      <row>
        <key>
          <binding label="*"/>
        </key>
        <key>
          <binding label="#"/>
        </key>
        <key>
          <binding label="+"/>
        </key>
        <key>
          <binding label="-"/>
        </key>
        <key>
          <binding label="_"/>
        </key>
        <key>
          <binding label="="/>
        </key>
        <key>
          <binding label="٪"/>
        </key>
        <key>
          <binding label="&#x0026;"/>
        </key>
        <key>
          <binding label="("/>
        </key>
        <key>
          <binding label=")"/>
        </key>
      </row>

      <row>
        <key style="special">
          <binding action="switch" label="1/2"/>
        </key>
        <key>
          <binding label="@" quickpick="true"/>
        </key>
        <key>
          <binding label="~"/>
        </key>
        <key>
          <binding label="/"/>
        </key>
        <key>
          <binding label="\"/>
        </key>
        <key>
          <binding label="&#x0027;" quickpick="true"/>
        </key>
        <key>
          <binding label="&#x066B;"/>
        </key>
        <key>
          <binding label="!"/>
        </key>
        <key>
          <binding label="&#x061F;"/>
        </key>
        
        <key style="special">
          <binding action="backspace"/>
        </key>
      </row>

      <row>
        <key style="special" width="large">
          <binding action="sym" label="&#x0627;&#x200C;&#x0628;&#x200C;&#x062A;"/>
        </key>
        
        <key><binding label="&#x060C;"/></key>
        <key><binding label="."/></key>
        
        <key width="stretched">
          <binding action="space"/>
        </key>
        
        <key><binding label="&#x061B;"/></key>
        
        <key style="special" width="xx-large" id="actionKey">
          <binding action="return"/>
        </key>

      </row>
    </section>

    <section id="symbols1" type="non-sloppy">
      <row>
        <key>
          <binding label="1"/>
        </key>
        <key>
          <binding label="2"/>
        </key>
        <key>
          <binding label="3"/>
        </key>
        <key>
          <binding label="4"/>
        </key>
        <key>
          <binding label="5"/>
        </key>
        <key>
          <binding label="6"/>
        </key>
        <key>
          <binding label="7"/>
        </key>
        <key>
          <binding label="8"/>
        </key>
        <key>
          <binding label="9"/>
        </key>
        <key>
          <binding label="0"/>
        </key>
      </row>

      <row>
        <key>
          <binding label="€"/>
        </key>
        <key>
          <binding label="£"/>
        </key>
        <key>
          <binding label="$"/>
        </key>
        <key>
          <binding label="¥"/>
        </key>
        <key>
          <binding label="﷼"/>
        </key>
        <key>
          <binding label="§"/>
        </key>
        <key>
          <binding label="%"/>
        </key>
        <key>
          <binding label="‰"/>
        </key>
        <key>
          <binding label="["/>
        </key>
        <key>
          <binding label="]"/>
        </key>
      </row>

      <row>
        <key style="special">
          <binding action="switch" label="2/2"/>
        </key>
        <key>
          <binding label="&lt;"/>
        </key>
        <key>
          <binding label="&gt;"/>
        </key>
        <key>
          <binding label="«"/>
        </key>
        <key>
          <binding label="»"/>
        </key>
        <key>
          <binding label="&#x0022;"/>
        </key>
        <key>
          <binding label="“"/>
        </key>
        <key>
          <binding label="”"/>
        </key>
        <key>
          <binding label="?"/>
        </key>

        <key style="special">
          <binding action="backspace"/>
        </key>
      </row>

      <row>
        <key style="special" width="large">
          <binding action="sym" label="&#x0627;&#x200C;&#x0628;&#x200C;&#x062A;"/>
        </key>
        
        <key><binding label=";"/></key>
        <key><binding label="."/></key>
        
        <key width="stretched">
          <binding action="space"/>
        </key>
		
        <key><binding label=":"/></key>
        
        <key style="special" width="xx-large" id="actionKey">
          <binding action="return"/>
        </key>
      </row>
    </section>
  </layout>
</keyboard>
