<?xml version="1.0" encoding="utf-8"?>
<!DOCTYPE keyboard SYSTEM 'VirtualKeyboardLayout.dtd'>
<keyboard version="1.0" title="Phone Number" language="phonenumber" catalog="phonenumber">
    <layout type="phonenumber" orientation="landscape">
        <section id="main" movable="false" horizontal_alignment="center" vertical_alignment="center">
          <row>
            <key>
              <binding label="1"/>
            </key>
            <key>
              <binding label="2" secondary_label="abc"/>
            </key>
            <key>
              <binding label="3" secondary_label="def"/>
            </key>
            <key>
              <binding label="4" secondary_label="ghi"/>
            </key>
            <key>
              <binding label="5" secondary_label="jkl"/>
            </key>
            <key>
              <binding label="6" secondary_label="mno"/>
            </key>
            <key>
              <binding label="7" secondary_label="pqrs"/>
            </key>
            <key>
              <binding label="8" secondary_label="tuv"/>
            </key>
            <key>
              <binding label="9" secondary_label="wxyz"/>
            </key>
            <key>
              <binding label="0"/>
            </key>
          </row>
        </section>
        <section id="functionkey" movable="false" horizontal_alignment="right" vertical_alignment="center">
          <row>
            <key>
              <binding label="&#x002A;&#x002B;" cycleset="&#x002A;&#x002B;pw" action="cycle"/>
            </key>
            <key>
              <binding label="&#x0023;"/>
            </key>
            <key>
              <binding label="" action="backspace"/>
            </key>
          </row>
        </section>
    </layout>
    <layout type="phonenumber" orientation="portrait">
        <section id="main" movable="false" horizontal_alignment="center" vertical_alignment="center">
          <row>
            <key>
              <binding label="1"/>
            </key>
            <key>
              <binding label="2" secondary_label="abc"/>
            </key>
            <key>
              <binding label="3" secondary_label="def"/>
            </key>
          </row>
          <row>
            <key>
              <binding label="4" secondary_label="ghi"/>
            </key>
            <key>
              <binding label="5" secondary_label="jkl"/>
            </key>
            <key>
              <binding label="6" secondary_label="mno"/>
            </key>
          </row>
          <row>
            <key>
              <binding label="7" secondary_label="pqrs"/>
            </key>
            <key>
              <binding label="8" secondary_label="tuv"/>
            </key>
            <key>
              <binding label="9" secondary_label="wxyz"/>
            </key>
          </row>
          <row>
            <key>
              <binding label="&#x002A;&#x002B;" cycleset="&#x002A;&#x002B;pw" action="cycle"/>
            </key>
            <key>
              <binding label="0"/>
            </key>
            <key>
              <binding label="&#x0023;"/>
            </key>
          </row>
        </section>
        <section id="functionkey" movable="false" horizontal_alignment="right" vertical_alignment="center">
          <row>
            <key>
              <binding label="" action="backspace"/>
            </key>
          </row>
        </section>
    </layout>
</keyboard>

