<?xml version="1.0" encoding="utf-8"?>
<!DOCTYPE keyboard SYSTEM 'VirtualKeyboardLayout.dtd'>
<keyboard title="Português" version="1.0" catalog="pt" language="pt">
    <layout type="general" orientation="landscape">
        <section id="main" movable="false" vertical_alignment="center" horizontal_alignment="center">
          <row>
            <key>
              <binding label="q"/>
              <binding shift="true" label="Q"/>
            </key>
            <key>
              <binding label="w"/>
              <binding shift="true" label="W"/>
            </key>
            <key>
              <binding accented_labels="èéê" accents="`´^" label="e"/>
              <binding shift="true" accented_labels="ÈÉÊ" accents="`´^" label="E"/>
            </key>
            <key>
              <binding label="r"/>
              <binding shift="true" label="R"/>
            </key>
            <key>
              <binding label="t"/>
              <binding shift="true" label="T"/>
            </key>
            <key>
              <binding accented_labels="ý" accents="´" label="y"/>
              <binding shift="true" accented_labels="Ý" accents="´" label="Y"/>
            </key>
            <key>
              <binding accented_labels="ùúû" accents="`´^" label="u"/>
              <binding shift="true" accented_labels="ÙÚÛ" accents="`´^" label="U"/>
            </key>
            <key>
              <binding accented_labels="ìíî" accents="`´^" label="i"/>
              <binding shift="true" accented_labels="ÌÍÎ" accents="`´^" label="I"/>
            </key>
            <key>
              <binding accented_labels="òóôõ" accents="`´^~" label="o"/>
              <binding shift="true" accented_labels="ÒÓÔÕ" accents="`´^~" label="O"/>
            </key>
            <key>
              <binding label="p"/>
              <binding shift="true" label="P"/>
            </key>
            <key>
              <binding dead="true" label="^"/>
            </key>
          </row>
          <row>
            <key>
              <binding accented_labels="àáâã" accents="`´^~" label="a"/>
              <binding shift="true" accented_labels="ÀÁÂÃ" accents="`´^~" label="A"/>
            </key>
            <key>
              <binding label="s"/>
              <binding shift="true" label="S"/>
            </key>
            <key>
              <binding label="d"/>
              <binding shift="true" label="D"/>
            </key>
            <key>
              <binding label="f"/>
              <binding shift="true" label="F"/>
            </key>
            <key>
              <binding label="g"/>
              <binding shift="true" label="G"/>
            </key>
            <key>
              <binding label="h"/>
              <binding shift="true" label="H"/>
            </key>
            <key>
              <binding label="j"/>
              <binding shift="true" label="J"/>
            </key>
            <key>
              <binding label="k"/>
              <binding shift="true" label="K"/>
            </key>
            <key>
              <binding label="l"/>
              <binding shift="true" label="L"/>
            </key>
            <key>
              <binding label="ç"/>
              <binding shift="true" label="Ç"/>
            </key>
            <key>
              <binding dead="true" label="~"/>
            </key>
          </row>
          <row>
            <key>
              <binding label="z"/>
              <binding shift="true" label="Z"/>
            </key>
            <key>
              <binding label="x"/>
              <binding shift="true" label="X"/>
            </key>
            <key>
              <binding label="c"/>
              <binding shift="true" label="C"/>
            </key>
            <key>
              <binding label="v"/>
              <binding shift="true" label="V"/>
            </key>
            <key>
              <binding label="b"/>
              <binding shift="true" label="B"/>
            </key>
            <key>
              <binding label="n"/>
              <binding shift="true" label="N"/>
            </key>
            <key>
              <binding label="m"/>
              <binding shift="true" label="M"/>
            </key>
            <key>
              <binding dead="true" label="´"/>
            </key>
            <key>
              <binding dead="true" label="`"/>
            </key>
            <key>
              <binding action="backspace" label=""/>
            </key>
          </row>
        </section>
        <section id="functionkey" movable="false" horizontal_alignment="left" vertical_alignment="center">
          <row>
            <key>
              <binding action="shift" label=""/>
            </key>
            <key>
              <binding action="sym" label="Sym" secondary_label="áçè"/>
              <binding shift="true" action="layout_menu" label=""/>
            </key>
            <key>
              <binding label="-"/>
              <binding shift="true" label="‘"/>
            </key>
            <key>
              <binding action="space" label=""/>
            </key>
            <key>
              <binding label="?"/>
              <binding shift="true" label="!"/>
            </key>
            <key>
              <binding label="."/>
              <binding shift="true" label=","/>
            </key>
            <key>
              <binding action="return" label=""/>
            </key>
          </row>
        </section>
    </layout>
    <layout type="general" orientation="portrait">
        <section id="functionkey" movable="false" horizontal_alignment="left" vertical_alignment="center">
          <row>
            <key>
              <binding action="shift" label=""/>
            </key>
            <key>
              <binding action="sym" label="Sym" secondary_label="áçè"/>
              <binding shift="true" action="layout_menu" label=""/>
            </key>
            <key>
              <binding action="space" label=""/>
            </key>
            <key>
              <binding label="."/>
              <binding shift="true" label=","/>
            </key>
            <key>
              <binding action="return" label=""/>
            </key>
          </row>
        </section>
    </layout>
    <import file="symbols.xml"/>
</keyboard>
